{
  "$schema": "http://json-schema.org/draft-07/schema#",
  "$id": "kiero/corpus/case.schema.json",
  "title": "Kiero evaluation corpus case fixture",
  "description": "One synthetic Polish case: tenant starting state, immutable source(s) with anchors, and lifecycle timeline. English keys, Polish content. All company/person names are synthetic.",
  "type": "object",
  "additionalProperties": false,
  "required": ["caseId", "modality", "corpusRevision", "title", "coverage", "fixtureClock", "tenant", "sources"],
  "properties": {
    "caseId": {
      "type": "string",
      "pattern": "^(T(0[1-9]|1[0-4])|V(0[1-9]|1[0-6])|I(0[1-9]|1[0-2])|M0[1-8])$",
      "description": "T=text, V=voice, I=image, M=mixed follow-up. Must match the fixture directory name."
    },
    "modality": { "enum": ["text", "voice", "image", "mixed"] },
    "corpusRevision": {
      "type": "string",
      "pattern": "^\\d{4}\\.\\d{2}\\.\\d+$",
      "description": "Corpus revision this fixture belongs to. Must equal manifest.json corpusRevision. Any corpus edit bumps it."
    },
    "title": { "type": "string", "minLength": 5, "description": "Short Polish title of the scenario." },
    "coverage": {
      "type": "array",
      "minItems": 1,
      "uniqueItems": true,
      "items": { "$ref": "#/definitions/coverageTag" },
      "description": "Evaluation dimensions exercised by this case. Every vocabulary tag must be used somewhere in the corpus."
    },
    "fixtureClock": {
      "type": "string",
      "pattern": "^\\d{4}-\\d{2}-\\d{2}T\\d{2}:\\d{2}:\\d{2}\\+02:00$",
      "description": "Authoritative send time of the first source in the firm timezone (Europe/Warsaw, CEST +02:00 in corpus period). Anchors relative-date interpretation; never the runner's clock."
    },
    "notes": { "type": "string", "description": "Optional authoring notes for humans (English)." },
    "tenant": { "$ref": "#/definitions/tenant" },
    "sources": {
      "type": "array",
      "minItems": 1,
      "items": { "$ref": "#/definitions/source" },
      "description": "Immutable source messages in send order. Text modality: exactly 1 source, text parts only. Voice: voice part(s) required. Image: image part(s) required. Mixed: at least 2 sources."
    },
    "timeline": {
      "type": "array",
      "items": { "$ref": "#/definitions/timelineEntry" },
      "description": "Explicit lifecycle and run-timing facts beyond send order: delayed run completions (stale plans), source withdrawal, permanent deletion."
    }
  },
  "definitions": {
    "coverageTag": {
      "enum": [
        "noisy_speech",
        "names",
        "amounts",
        "self_correction",
        "relative_dates",
        "date_precision",
        "unknown_tax_basis",
        "estimate_vs_agreed",
        "handwriting",
        "technical_dimensions",
        "similar_aliases",
        "mixed_projects",
        "incomplete_evidence",
        "stale_plan",
        "withdrawal_deletion",
        "corroboration"
      ]
    },
    "ref": { "type": "string", "pattern": "^(B|C|P)-[A-Z0-9-]{2,24}$", "description": "Tenant-local entity reference: B-* boss, C-* contact, P-* project." },
    "isoDateTimePlus0200": {
      "type": "string",
      "pattern": "^\\d{4}-\\d{2}-\\d{2}T\\d{2}:\\d{2}:\\d{2}\\+02:00$",
      "description": "Firm timezone is Europe/Warsaw; the corpus period is CEST (+02:00)."
    },
    "tenant": {
      "type": "object",
      "additionalProperties": false,
      "required": ["firm", "bosses", "projects"],
      "properties": {
        "firm": {
          "type": "object",
          "additionalProperties": false,
          "required": ["name", "timezone", "defaultCurrency"],
          "properties": {
            "name": { "type": "string", "minLength": 2, "description": "Synthetic Polish firm name." },
            "timezone": { "const": "Europe/Warsaw" },
            "defaultCurrency": { "const": "PLN" }
          }
        },
        "bosses": {
          "type": "array",
          "minItems": 1,
          "items": {
            "type": "object",
            "additionalProperties": false,
            "required": ["ref", "name", "role"],
            "properties": {
              "ref": { "$ref": "#/definitions/ref" },
              "name": { "type": "string", "minLength": 2 },
              "role": { "enum": ["administrator firmy", "szef"] }
            }
          }
        },
        "contacts": {
          "type": "array",
          "items": {
            "type": "object",
            "additionalProperties": false,
            "required": ["ref", "name", "kind"],
            "properties": {
              "ref": { "$ref": "#/definitions/ref" },
              "name": { "type": "string", "minLength": 2 },
              "kind": { "enum": ["person", "organization"] },
              "phone": { "type": "string" },
              "detail": { "type": "string", "description": "Polish free-text detail, e.g. handlowiec." }
            }
          }
        },
        "projects": {
          "type": "array",
          "minItems": 1,
          "items": {
            "type": "object",
            "additionalProperties": false,
            "required": ["ref", "alias", "stage"],
            "properties": {
              "ref": { "$ref": "#/definitions/ref" },
              "alias": { "type": "string", "minLength": 2, "description": "Alias projektu per glossary; firm-unique." },
              "client": { "$ref": "#/definitions/ref" },
              "stage": {
                "enum": ["zapytanie", "wycena", "uzgodnienie", "realizacja", "oddanie", "zakonczone", "wstrzymany"]
              },
              "location": { "type": "string" },
              "detail": { "type": "string" }
            }
          }
        },
        "existingFindings": {
          "type": "array",
          "description": "Ustalenia already current BEFORE this case's sources. Never created by this case's model run; part of the starting state the runner must reset to.",
          "items": {
            "type": "object",
            "additionalProperties": false,
            "required": ["scope", "findingKey", "knowledgeState"],
            "properties": {
              "scope": { "$ref": "#/definitions/scope" },
              "findingKey": { "type": "string", "pattern": "^[a-z][a-z0-9_]*$", "minLength": 3 },
              "knowledgeState": { "$ref": "#/definitions/knowledgeState" },
              "value": { "$ref": "#/definitions/value" },
              "note": { "type": "string", "description": "Polish summary of the pre-existing ustalenie." }
            }
          }
        }
      }
    },
    "scope": {
      "type": "object",
      "additionalProperties": false,
      "required": ["level", "ref"],
      "properties": {
        "level": { "enum": ["project", "company"] },
        "ref": {
          "type": "string",
          "pattern": "^(COMPANY|[A-Z0-9-]{2,26})$",
          "description": "Project ref for project scope, literal COMPANY for company scope."
        }
      }
    },
    "knowledgeState": { "enum": ["known", "unknown", "conflicted", "not_applicable"] },
    "source": {
      "type": "object",
      "additionalProperties": false,
      "required": ["sourceId", "author", "sentAt", "parts"],
      "properties": {
        "sourceId": { "type": "string", "pattern": "^S[1-9][0-9]?$" },
        "author": { "$ref": "#/definitions/ref" },
        "sentAt": { "$ref": "#/definitions/isoDateTimePlus0200" },
        "fullyAcceptedAt": { "$ref": "#/definitions/isoDateTimePlus0200" },
        "projectPill": {
          "type": "string",
          "pattern": "^P-[A-Z0-9-]{2,24}$",
          "description": "Optional project context pill attached in the UI; context only, never forces attribution of every clause."
        },
        "parts": { "type": "array", "minItems": 1, "items": { "$ref": "#/definitions/part" } }
      }
    },
    "part": {
      "type": "object",
      "oneOf": [
        { "$ref": "#/definitions/textPart" },
        { "$ref": "#/definitions/voicePart" },
        { "$ref": "#/definitions/imagePart" }
      ]
    },
    "textPart": {
      "type": "object",
      "additionalProperties": false,
      "required": ["partId", "type", "text"],
      "properties": {
        "partId": { "type": "string", "pattern": "^S[1-9][0-9]?-txt[0-9]?$" },
        "type": { "const": "text" },
        "text": { "type": "string", "minLength": 8, "description": "Exact Polish message text. Text-quote anchors reference substrings of this string." }
      }
    },
    "voicePart": {
      "type": "object",
      "additionalProperties": false,
      "required": ["partId", "type", "durationSeconds", "transcript", "assetProvenance"],
      "properties": {
        "partId": { "type": "string", "pattern": "^S[1-9][0-9]?-aud[0-9]?$" },
        "type": { "const": "voice" },
        "durationSeconds": { "type": "number", "exclusiveMinimum": 0 },
        "transcript": {
          "type": "string",
          "minLength": 8,
          "description": "Human-authored canonical Polish transcript. SOURCE OF TRUTH for expected STT while the audio asset is pending generation."
        },
        "recordingContext": {
          "type": "string",
          "description": "Polish description of recording conditions the audio must reproduce (noise, crosstalk, phone quality)."
        },
        "assetProvenance": { "$ref": "#/definitions/assetProvenance" }
      }
    },
    "imagePart": {
      "type": "object",
      "additionalProperties": false,
      "required": ["partId", "type", "asset", "widthPx", "heightPx", "contentDescription", "assetProvenance"],
      "properties": {
        "partId": { "type": "string", "pattern": "^S[1-9][0-9]?-img[0-9]?$" },
        "type": { "const": "image" },
        "asset": { "type": "string", "pattern": "^[A-Za-z0-9_-]+\\.svg$", "description": "File name, resolved relative to this case directory." },
        "widthPx": { "type": "integer", "minimum": 100 },
        "heightPx": { "type": "integer", "minimum": 100 },
        "contentDescription": {
          "type": "string",
          "minLength": 10,
          "description": "Human-authored ground-truth description of everything legible in the image. Authoritative for expected vision extraction."
        },
        "assetProvenance": { "$ref": "#/definitions/assetProvenance" }
      }
    },
    "assetProvenance": {
      "type": "object",
      "additionalProperties": false,
      "required": ["status"],
      "properties": {
        "status": { "enum": ["generated", "pending_generation"] },
        "generator": { "type": "string", "description": "Repository path of the deterministic generator script (generated assets)." },
        "generatorVersion": { "type": "integer", "minimum": 1 },
        "seed": { "type": "integer", "minimum": 0 },
        "sha256": { "type": "string", "pattern": "^[0-9a-f]{64}$" },
        "statement": {
          "type": "string",
          "description": "For pending_generation: explicit honest statement of what stands in for the missing asset."
        },
        "note": { "type": "string" }
      }
    },
    "timelineEntry": {
      "type": "object",
      "oneOf": [
        { "$ref": "#/definitions/runCompletionEntry" },
        { "$ref": "#/definitions/sourceWithdrawnEntry" },
        { "$ref": "#/definitions/sourceDeletedEntry" }
      ]
    },
    "runCompletionEntry": {
      "type": "object",
      "additionalProperties": false,
      "required": ["type", "sourceId", "completesAt"],
      "properties": {
        "type": { "const": "run_completion" },
        "sourceId": { "type": "string", "pattern": "^S[1-9][0-9]?$" },
        "completesAt": { "$ref": "#/definitions/isoDateTimePlus0200" },
        "reason": { "type": "string", "description": "Why processing was delayed (backlog, provider outage) — the stale-plan setup." }
      }
    },
    "sourceWithdrawnEntry": {
      "type": "object",
      "additionalProperties": false,
      "required": ["type", "sourceId", "at", "by", "reason"],
      "properties": {
        "type": { "const": "source_withdrawn" },
        "sourceId": { "type": "string", "pattern": "^S[1-9][0-9]?$" },
        "at": { "$ref": "#/definitions/isoDateTimePlus0200" },
        "by": { "$ref": "#/definitions/ref" },
        "reason": { "type": "string", "minLength": 5, "description": "Polish reason recorded in history." }
      }
    },
    "sourceDeletedEntry": {
      "type": "object",
      "additionalProperties": false,
      "required": ["type", "sourceId", "at", "by", "reason"],
      "properties": {
        "type": { "const": "source_deleted" },
        "sourceId": { "type": "string", "pattern": "^S[1-9][0-9]?$" },
        "at": { "$ref": "#/definitions/isoDateTimePlus0200" },
        "by": { "$ref": "#/definitions/ref" },
        "reason": { "type": "string", "minLength": 5 }
      }
    },
    "value": {
      "description": "Typed value union per the architecture value contracts.",
      "anyOf": [
        { "$ref": "#/definitions/temporalValue" },
        { "$ref": "#/definitions/financialValue" },
        { "$ref": "#/definitions/quantityValue" },
        { "$ref": "#/definitions/textValue" },
        { "$ref": "#/definitions/enumValue" },
        { "$ref": "#/definitions/entityRefValue" }
      ]
    },
    "temporalValue": {
      "type": "object",
      "additionalProperties": false,
      "required": ["kind", "precision", "role"],
      "properties": {
        "kind": { "const": "temporal" },
        "precision": { "enum": ["date", "datetime", "range", "week"] },
        "role": {
          "enum": ["proposal", "internal_plan", "agreed", "actual", "deadline"],
          "description": "Znaczenie terminu: propozycja, wewnętrzny plan, uzgodniony, faktyczny, termin krytyczny."
        },
        "date": { "type": "string", "pattern": "^\\d{4}-\\d{2}-\\d{2}$" },
        "datetime": { "$ref": "#/definitions/isoDateTimePlus0200" },
        "timeOfDay": { "type": "string", "pattern": "^\\d{2}:\\d{2}$" },
        "fromDate": { "type": "string", "pattern": "^\\d{4}-\\d{2}-\\d{2}$" },
        "toDate": { "type": "string", "pattern": "^\\d{4}-\\d{2}-\\d{2}$" },
        "fromTime": { "type": "string", "pattern": "^\\d{2}:\\d{2}$" },
        "toTime": { "type": "string", "pattern": "^\\d{2}:\\d{2}$" },
        "originalExpression": { "type": "string", "description": "Polish expression as actually said/written; preserved verbatim." },
        "qualifier": { "type": "string", "description": "e.g. 'rano' — kept as qualifier, never converted into an invented hour." }
      }
    },
    "financialValue": {
      "type": "object",
      "additionalProperties": false,
      "required": ["kind", "role", "precision", "currency", "currencyOrigin", "vatBasis"],
      "properties": {
        "kind": { "const": "financial" },
        "role": {
          "enum": ["agreed_price", "quoted_price", "estimated_price", "proposal_price", "material_cost", "labor_cost", "deposit", "payment"]
        },
        "amount": { "type": "string", "pattern": "^\\d+\\.\\d{2}$", "description": "Exact decimal string, e.g. 12500.00. Decimal-safe; never a float." },
        "minAmount": { "type": "string", "pattern": "^\\d+\\.\\d{2}$" },
        "maxAmount": { "type": "string", "pattern": "^\\d+\\.\\d{2}$" },
        "precision": { "enum": ["exact", "approximate", "range"] },
        "currency": { "pattern": "^[A-Z]{3}$" },
        "currencyOrigin": { "enum": ["stated", "firm_default"] },
        "vatBasis": {
          "enum": ["net", "gross", "not_specified"],
          "description": "never-infer-VAT: an unstated basis stays not_specified forever until a source states it."
        },
        "originalExpression": { "type": "string" }
      }
    },
    "quantityValue": {
      "type": "object",
      "additionalProperties": false,
      "required": ["kind", "value", "unit"],
      "properties": {
        "kind": { "const": "quantity" },
        "value": { "type": "string", "pattern": "^\\d+([.,]\\d+)?$" },
        "unit": {
          "enum": ["mm", "cm", "m", "m2", "szt", "paleta", "kursy"],
          "description": "Original unit preserved; never silently converted."
        },
        "secondValue": { "type": "string", "pattern": "^\\d+([.,]\\d+)?$", "description": "For LxW pairs, e.g. 60x30 cm." },
        "originalExpression": { "type": "string" }
      }
    },
    "textValue": {
      "type": "object",
      "additionalProperties": false,
      "required": ["kind", "value"],
      "properties": {
        "kind": { "const": "text" },
        "value": { "type": "string", "minLength": 1, "description": "Exact Polish text, diacritics preserved." }
      }
    },
    "enumValue": {
      "type": "object",
      "additionalProperties": false,
      "required": ["kind", "value"],
      "properties": {
        "kind": { "const": "enum" },
        "value": { "type": "string", "minLength": 1 } ,
        "options": { "type": "array", "items": { "type": "string" } }
      }
    },
    "entityRefValue": {
      "type": "object",
      "additionalProperties": false,
      "required": ["kind", "entity", "ref", "display"],
      "properties": {
        "kind": { "const": "entity_ref" },
        "entity": { "enum": ["contact", "project", "boss"] },
        "ref": { "$ref": "#/definitions/ref" },
        "display": { "type": "string" }
      }
    }
  }
}
