{
  "caseId": "M01",
  "modality": "mixed",
  "corpusRevision": "2026.09.1",
  "title": "Cena potwierdzona tekstem i głosówką",
  "coverage": ["corroboration", "amounts"],
  "fixtureClock": "2026-09-16T09:00:00+02:00",
  "notes": "Cross-modal corroboration of one price: S1 (text, Wojtek) and S2 (voice, Marek) independently state 24 000 netto. One finding, two sources.",
  "tenant": {
    "firm": { "name": "Bud-Ka Remonty", "timezone": "Europe/Warsaw", "defaultCurrency": "PLN" },
    "bosses": [
      { "ref": "B-WOJTEK", "name": "Wojtek", "role": "administrator firmy" },
      { "ref": "B-MAREK", "name": "Marek", "role": "szef" }
    ],
    "contacts": [{ "ref": "C-KOWALSKI", "name": "Kowalski", "kind": "person", "detail": "klient" }],
    "projects": [{ "ref": "P-BANAN", "alias": "Banan", "client": "C-KOWALSKI", "stage": "uzgodnienie" }]
  },
  "sources": [
    {
      "sourceId": "S1",
      "author": "B-WOJTEK",
      "sentAt": "2026-09-16T09:00:00+02:00",
      "fullyAcceptedAt": "2026-09-16T09:00:03+02:00",
      "projectPill": "P-BANAN",
      "parts": [
        {
          "partId": "S1-txt",
          "type": "text",
          "text": "Kowalski potwierdził cenę za cały remont na Bananie: 24 000 zł netto. Umawiamy się."
        }
      ]
    },
    {
      "sourceId": "S2",
      "author": "B-MAREK",
      "sentAt": "2026-09-16T14:30:00+02:00",
      "fullyAcceptedAt": "2026-09-16T14:30:08+02:00",
      "projectPill": "P-BANAN",
      "parts": [
        {
          "partId": "S2-aud",
          "type": "voice",
          "durationSeconds": 12.0,
          "transcript": "Byłem przy telefonie z Kowalskim: 24 tysiące netto za Banan, potwierdzam.",
          "recordingContext": "Głosówka Marka z biura.",
          "assetProvenance": {
            "status": "pending_generation",
            "statement": "Synthetic audio pending generation; the transcript in this fixture is the source of truth for expected STT (audio tooling owned by D6/J3).",
            "note": "Planned voice asset: male speaker B."
          }
        }
      ]
    }
  ]
}
