{
  "caseId": "V01",
  "modality": "voice",
  "corpusRevision": "2026.09.1",
  "title": "Zamówienie z pauzami i hałasem budowy",
  "coverage": ["noisy_speech", "amounts"],
  "fixtureClock": "2026-09-14T07:10:00+02:00",
  "notes": "Disfluent, noisy speech. Monday send: 'we wtorek' = 2026-09-15. 'dwanaście i pół tysiąca' must survive as words or exact digits, never 12.5 zł.",
  "tenant": {
    "firm": { "name": "Bud-Ka Remonty", "timezone": "Europe/Warsaw", "defaultCurrency": "PLN" },
    "bosses": [{ "ref": "B-WOJTEK", "name": "Wojtek", "role": "administrator firmy" }],
    "contacts": [],
    "projects": [{ "ref": "P-BANAN", "alias": "Banan", "stage": "realizacja" }]
  },
  "sources": [
    {
      "sourceId": "S1",
      "author": "B-WOJTEK",
      "sentAt": "2026-09-14T07:10:00+02:00",
      "fullyAcceptedAt": "2026-09-14T07:10:09+02:00",
      "projectPill": "P-BANAN",
      "parts": [
        {
          "partId": "S1-aud",
          "type": "voice",
          "durationSeconds": 28.0,
          "transcript": "No więc... słuchaj... płytki na Banana przychodzą... eee... we wtorek, rano chyba. Za paletę płacimy... dwanaście i pół tysiąca. No i tyle, zapisz.",
          "recordingContext": "Nagranie z budowy: w tle pracuje mieszarka, mówca mówi przez telefon, słychać fills (eee, no więc).",
          "assetProvenance": {
            "status": "pending_generation",
            "statement": "Synthetic audio pending generation; the transcript in this fixture is the source of truth for expected STT (audio tooling owned by D6/J3).",
            "note": "Planned voice asset: single male speaker, phone quality, construction noise bed."
          }
        }
      ]
    }
  ]
}
