{
  "caseId": "T01",
  "modality": "text",
  "corpusRevision": "2026.09.1",
  "title": "Termin dostawy w przyszły czwartek",
  "coverage": ["relative_dates", "date_precision"],
  "fixtureClock": "2026-09-14T07:40:00+02:00",
  "notes": "Anchors relative dates to fixtureClock (Monday). 'w przyszły czwartek' = Thursday of next week = 2026-09-24. Date-only: no hour may be invented.",
  "tenant": {
    "firm": { "name": "Bud-Ka Remonty", "timezone": "Europe/Warsaw", "defaultCurrency": "PLN" },
    "bosses": [{ "ref": "B-WOJTEK", "name": "Wojtek", "role": "administrator firmy" }],
    "contacts": [{ "ref": "C-KOWALSKI", "name": "Kowalski", "kind": "person", "detail": "klient" }],
    "projects": [
      { "ref": "P-BANAN", "alias": "Banan", "client": "C-KOWALSKI", "stage": "realizacja", "location": "ul. Wiśniowa 12, Wrocław" }
    ],
    "existingFindings": []
  },
  "sources": [
    {
      "sourceId": "S1",
      "author": "B-WOJTEK",
      "sentAt": "2026-09-14T07:40:00+02:00",
      "fullyAcceptedAt": "2026-09-14T07:40:03+02:00",
      "projectPill": "P-BANAN",
      "parts": [
        {
          "partId": "S1-txt",
          "type": "text",
          "text": "Ustaliliśmy z Kowalskim: dostawa płytek na Bananie w przyszły czwartek, bez konkretnej godziny. Proszę odnotować."
        }
      ]
    }
  ]
}
