{
  "caseId": "V16",
  "modality": "voice",
  "corpusRevision": "2026.09.1",
  "title": "Wymiary schodów słownie",
  "coverage": ["technical_dimensions"],
  "fixtureClock": "2026-09-25T09:00:00+02:00",
  "notes": "Spoken dimensions: steps 60x30 cm, 14 pieces, sheet metal 4 mm. Units must be preserved verbatim: no silent cm->mm or mm->cm conversion.",
  "tenant": {
    "firm": { "name": "Bud-Ka Remonty", "timezone": "Europe/Warsaw", "defaultCurrency": "PLN" },
    "bosses": [{ "ref": "B-MAREK", "name": "Marek", "role": "administrator firmy" }],
    "contacts": [],
    "projects": [{ "ref": "P-BANANOWA", "alias": "Bananowa", "stage": "realizacja" }]
  },
  "sources": [
    {
      "sourceId": "S1",
      "author": "B-MAREK",
      "sentAt": "2026-09-25T09:00:00+02:00",
      "fullyAcceptedAt": "2026-09-25T09:00:07+02:00",
      "projectPill": "P-BANANOWA",
      "parts": [
        {
          "partId": "S1-aud",
          "type": "voice",
          "durationSeconds": 19.0,
          "transcript": "Schody na Bananowej: stopnie sześćdziesiąt na trzydzieści centymetrów, czternaście sztuk. Blacha na podstopnice cztery milimetry. Jednostki zostaw takie, jak mówię.",
          "recordingContext": "Nagranie przy schodach, lekki pogłos.",
          "assetProvenance": {
            "status": "pending_generation",
            "statement": "Synthetic audio pending generation; the transcript in this fixture is the source of truth for expected STT (audio tooling owned by D6/J3).",
            "note": "Planned voice asset: male speaker, stairwell ambience."
          }
        }
      ]
    }
  ]
}
